{
  "liftoff-json-version": 1,
  "basic": {
    "project-name": "My amazing game!",
    "core-package": "com.example.json",
    "main-class": "EntryPointClass",
    "android-sdk-path": "C:/Users/payne/android-sdk"
  },
  "platforms": [
    "android",
    "lwjgl3",
    "server"
  ],
  "languages": [
    {
      "language": "groovy",
      "version": "3.0.+"
    },
    {
      "language": "kotlin",
      "version": "1.3.+"
    }
  ],
  "extensions": [
    "ashley",
    "ai",
    "box2d"
  ],
  "third-party": [
    {
      "library": "shape-drawer",
      "version": "2.3.0"
    },
    {
      "library": "typing-label",
      "version": "1.2.0"
    }
  ],
  "versions": {
    "libgdx": "1.9.11",
    "java": "8.0",
    "server-java": "14.0",
    "desktop-java": "11.0",
    "android-target-api": 29,
    "android-plugin": "4.0.0"
  },
  "add-ons": [
    "readme",
    "gui-assets",
    "gradle-wrapper"
  ],
  "template": "game"
}